{
  "url": "http://archives.sfmta.com/transitdata/google_transit.zip",
  "feedFormat": "gtfs",
  "tags": {
    "licenseUrl": "http://www.sfmta.com/about-sfmta/reports/gtfs-transit-data"
  },
  "operatorsInFeed": [
    {
      "operator": {
        "name": "San Francisco Municipal Transportation Agency",
        "tags": {
          "us_national_transit_database_id": 9015,
          "website": "http://www.sfmta.com",
          "timezone": "America/Los_Angeles"
        },
        "identifiers": [
          { "identifier": "MUNI" },
          { "identifier": "SFMTA" }
        ],
        "onestop_id": "o-9q8y-SFMTA",
        "geometry": {"type":"Feature","properties":{},"geometry":{"type":"Polygon","coordinates":[[[-122.53867,37.83238],[-122.506821,37.735482],[-122.500028,37.718996],[-122.499913,37.718738],[-122.49766,37.71677],[-122.485294,37.709312],[-122.48498,37.70913],[-122.469273,37.705764],[-122.413084,37.706296],[-122.39422,37.70898],[-122.392836,37.709804],[-122.365447,37.72792],[-122.36633,37.820001],[-122.371964,37.828311],[-122.373477,37.82982],[-122.48383,37.83592],[-122.50214,37.836443],[-122.53867,37.83238]]]}}
      },
      "gtfsAgencyId": "SFMTA"
    }
  ]
}
