{
  "url": "http://www.samtrans.com/Assets/GTFS/samtrans/SamTrans-GTFS-RB115-rev-08252014.zip",
  "feedFormat": "gtfs",
  "tags": {
    "licenseUrl": "http://www.samtrans.com/Developer/DLA-PP-SamTrans.html",
    "downloadPageUrl": "http://www.samtrans.com/Developer/DLA-PP-SamTrans.html?IsSubmitted=True"
  },
  "operatorsInFeed": [
    {
      "operator": {
        "name": "San Mateo County Transit District",
        "tags": {
          "us_national_transit_database_id": 9009,
          "website": "http://www.samtrans.com",
          "timezone": "America/Los_Angeles"
        },
        "identifiers": [
          { "identifier": "SamTrans" }
        ],
        "onestop_id": "o-9q9-SamTrans",
        "geometry": {"type":"Feature","properties":{},"geometry":{"type":"Polygon","coordinates":[[[-122.51796,37.53556],[-122.412922,37.259608],[-122.3925,37.2503],[-122.382827,37.251686],[-122.21142,37.36789],[-122.19961,37.37708],[-122.194621,37.381745],[-122.12492,37.45734],[-122.13037,37.47045],[-122.13207,37.47271],[-122.39243,37.79009],[-122.39695,37.790137],[-122.39728,37.7901],[-122.41845,37.77518],[-122.48333,37.72698],[-122.485105,37.724185],[-122.49301,37.68985],[-122.515757,37.569983],[-122.51796,37.53556]]]}}
      },
      "gtfsAgencyId": "SamTrans"
    }
  ]
}
